AU,TI,SO,AB,PY,VL,DI
"Darcy, JL; Gendron, EMS; Sommers, P; Porazinska, DL; Schmidt, SK",Island Biogeography of Cryoconite Hole Bacteria in Antarcticas Taylor Valley and Around the World,FRONTIERS IN ECOLOGY AND EVOLUTION,"Cryoconite holes are holes in a glaciers surface caused by sediment melting into the glacier. These holes are self-contained ecosystems that include abundant bacterial life within their sediment and liquid water, and have recently gained the attention of microbial ecologists looking to use cryoconite holes as natural microcosms to study microbial community assembly. Here, we explore the idea that cryoconite holes can be viewed as islands, in the same sense that an island in the ocean is an area of habitat surrounded by a barrier to entry. In the case of a classic oceanic island, the ocean is a barrier between islands, but in the case of cryoconite holes, the ocean is comprised of impermeable solid ice. We test two hypotheses, born out of island biogeographic theory, that can be readily applied to cryoconite hole bacteria. First, we ask to what extent the size of a cryoconite hole is related to the amount of bacterial diversity found within it. Second, we ask to what extent cryoconite holes exhibit distance decay of similarity, meaning that geographically close holes are expected to harbor similar bacterial communities, and distant holes are expected to harbor more different bacterial communities. To test the island size hypothesis, we measured the sizes of cryoconite holes on three glaciers in Antarcticas Taylor Valley and used DNA sequencing to measure diversity of bacterial communities within them. We found that for two of these glaciers, there is a strong relationship between hole size and bacterial phylogenetic diversity, supporting the idea that cryoconite holes on those glaciers are islands. The high biomass dispersing to the third glacier we measured could explain the lack of size-diversity relationship, remaining consistent with island biogeography. To test the distance decay of similarity hypothesis, we used DNA sequence data from several previous studies of cryoconite hole bacteria from across the world. Combined with our Taylor Valley data, those data showed that cryoconite holes have strong spatial structuring at scales of one to several hundred kilometers, also supporting the idea that these dirty holes on glaciers are really islands in the cryosphere.",2018,6,10.3389/fevo.2018.00180
"Wang, X; Wang, C; Wang, PF; Chen, J; Miao, LZ; Feng, T; Yuan, QS; Liu, S",How bacterioplankton community can go with cascade damming in the highly regulated Lancang-Mekong River Basin,MOLECULAR ECOLOGY,"Rivers make vital contributions to the transport of water, sediment and nutrients from terrestrial to marine ecosystems. However, many large rivers worldwide are suffering from dam regulation. Increasing attention has been paid to bacterioplankton communities since they are highly responsive to river alterations and may influence biogeochemical processes. Here, a comprehensive study was conducted in the highly regulated Lancang-Mekong River Basin to address the question of how bacterioplankton communities respond to cascade damming. The results showed that dam constructions increased nutrient concentrations and threatened water quality in cascade reservoirs. Bacterioplankton cell abundance was reduced by damming, and alpha-diversity was inhibited in cascade reservoirs. Fortunately, however, river ecosystems were resilient after the remarkable disturbance caused by damming. Moreover, bacterioplankton community composition was significantly altered by cascade dams, including a shift in the dominant phylum from r-strategists to k-strategists. Meanwhile, according to GeoChip analysis, the functional composition of bacterioplankton was less affected than taxonomic composition. In addition, geographic and environmental features both followed a distance-decay relationship with community and functional composition, but the local environment condition was the dominant driver in the Lancang River. Therefore, the impoundments of cascade dams had significant impacts on bacterioplankton communities and more attention should be paid to the potential ecological consequences of river regulation.",2018,27,10.1111/mec.14870
"Shade, A; Dunn, RR; Blowes, SA; Keil, P; Bohannan, BJM; Herrmann, M; Kusel, K; Lennon, JT; Sanders, NJ; Storch, D; Chase, J","Macroecology to Unite All Life, Large and Small",TRENDS IN ECOLOGY & EVOLUTION,"Macroecology is the study of the mechanisms underlying general patterns of ecology across scales. Research in microbial ecology and macroecology have long been detached. Here, we argue that it is time to bridge the gap, as they share a common currency of species and individuals, and a common goal of understanding the causes and consequences of changes in biodiversity. Microbial ecology and macroecology will mutually benefit from a unified research agenda and shared datasets that span the entirety of the biodiversity of life and the geographic expanse of the Earth.",2018,33,10.1016/j.tree.2018.08.005
"Kavazos, CRJ; Huggett, MJ; Mueller, U; Horwitz, P",Bacterial and ciliate biofilm community structure at different spatial levels of a salt lake meta-community,FEMS MICROBIOLOGY ECOLOGY,"Meta-communities are assembled along an ecological scale that determines local and regional diversity. Spatial patterns have been detected in planktonic bacterial communities at distances <20 m, but little is known about the occurrence of similar variation for other microbial groups and changes in microbial meta-community assembly at different levels of a meta-community. To examine this variation, the biofilm of eight saline ponds were used to investigate processes shaping diversity within ponds (beta) and between ponds (delta). Bacterial and ciliate communities were assessed using ARISA and T-RFLP respectively, while diversity partitioning methods were used to examine the importance of taxonomic turnover and variation partitioning was used to distinguish spatial from environmental determinants. The results show that turnover is important for determining beta- and delta-diversity of biofilms. Spatial factors are important drivers of bacterial beta-diversity but were unimportant for ciliate beta-diversity. Environmental variation was a strong determinant of bacterial and ciliate delta-diversity, suggesting sorting processes are important for assembling pond communities. Determinants of diversity in bacteria are not universal for ciliates, suggesting higher functional redundancy of bacteria or the greater niche breadth of ciliates may be important in discriminating assembly processes between the two organisms.",2018,94,10.1093/femsec/fiy148
"Echenique-Subiabre, I; Zancarini, A; Heath, MW; Wood, SA; Quiblier, C; Humbert, JF",Multiple processes acting from local to large geographical scales shape bacterial communities associated with Phormidium (cyanobacteria) biofilms in French and New Zealand rivers,SCIENTIFIC REPORTS,"River biofilms dominated by Phormidium (cyanobacteria) are receiving increased attention worldwide because of a recent expansion in their distribution and their ability to produce neurotoxins leading to animal mortalities. Limited data are available on the composition and structure of bacterial communities (BCs) associated with Phormidium biofilms despite the important role they potentially play in biofilm functioning. By using a high-throughput sequencing approach, we compared the BCs associated with Phormidium biofilms in several sampling sites of the Tarn River (France) and in eight New Zealand rivers. The structure of the BCs from both countries displayed spatial and temporal variations but were well conserved at the order level and 28% of the OTUs containing 90% of the reads were shared by these BCs. This suggests that micro-environmental conditions occurring within thick Phormidium biofilms strongly shape the associated BCs. A strong and significant distance-decay relationship (r(p) = 0.7; P = 0.001) was found in BCs from New Zealand rivers but the Bray-Curtis dissimilarities between French and New Zealand BCs are in the same order of magnitude of those found between New Zealand BCs. All these findings suggest that local environmental conditions seem to have more impact on BCs than dispersal capacities of bacteria.",2018,8,10.1038/s41598-018-32772-w
"Deakin, G; Tilston, EL; Bennett, J; Passey, T; Harrison, N; Fernandez-Fernandez, F; Xu, XM",Spatial structuring of soil microbial communities in commercial apple orchards,APPLIED SOIL ECOLOGY,"Characterising spatial microbial community structure is important to understand and explain the consequences of continuous plantation of one crop species on the performance of subsequent crops, especially where this leads to reduced growth vigour and crop yield. We investigated the spatial structure, specifically distance-decay of similarity, of soil bacterial and fungal communities in two long-established orchards with contrasting agronomic characteristics. A spatially explicit sampling strategy was used to collect soil from under recently grubbed rows of apple trees and under the grassed aisles. Amplicon-based metabarcoding technology was used to characterise the soil microbial communities. The results suggested that (1) most of the differences in soil microbial community structure were due to large-scale differences (i.e. between orchards), (2) within-orchard, small-scale (1-5 m) spatial variability was also present, but spatial relationships in microbial community structure differed between orchards and were not predictable, and (3) vegetation type (i.e. trees or grass and their associated management) can significantly alter the structure of soil microbial communities, affecting a large proportion of microbial groups. The discontinuous nature of soil microbial community structure in the tree stations and neighbouring grass aisles within an orchard illustrate the importance of vegetation type and allied weed and nutrient management on soil microbial community structure.",2018,130,10.1016/j.apsoil.2018.05.015
"Ribeiro, KF; Duarte, L; Crossetti, LO",Everything is not everywhere: a tale on the biogeography of cyanobacteria,HYDROBIOLOGIA,"Microrganisms such as cyanobacteria have been often considered as exhibiting wide distribution mainly driven by environmental heterogeneity. Recently, however, new findings have evoked the role of previously neglected processes, such as dispersal limitation, determining the distribution of a wide range of microorganisms, including cyanobacteria. Here, we reviewed the biogeographic patterns of cyanobacteria with focus on molecular data and the evidences from the published literature for the processes driving these patterns. Also, considerations are made about concept of species, discordances in the taxonomic concepts, and level of taxonomic resolution, and how these affect the biogeographic study of cyanobacteria. From a overview, it can be observed that both environmental and historical factors are important to structure cyanobacteria diversity across time and space. Moreover, different species may exhibit significant differences in their distribution patterns, from possibly cosmopolitan species to other endemic species. However, distribution patterns are closely dependent on the concept of species, besides the taxonomic resolution, spatial and environmental scales, and the biases of the molecular methodologies applied in the studies. Thus, efforts to broaden sampling and sequencing of unknown and less-known species, as well as geographic regions and habitats poorly exploited, are crucial for a better understanding of cyanobacteria biogeography.",2018,820,10.1007/s10750-018-3669-x
"Mo, YY; Zhang, WJ; Yang, J; Lin, YS; Yu, Z; Lin, SJ",Biogeographic patterns of abundant and rare bacterioplankton in three subtropical bays resulting from selective and neutral processes,ISME JOURNAL,"Unraveling the relative importance of ecological processes regulating microbial community structure is a central goal in microbial ecology. Here, we used high-throughput sequencing to examine the relative contribution of selective and neutral processes in the assembly of abundant and rare subcommunities from three subtropical bays of China. We found that abundant and rare bacterial taxa were distinctly different in diversity, despite the similar biogeographic patterns and strong distance-decay relationships, but the dispersal of rare bacterial taxa was more limited than that of abundant taxa. Furthermore, the environmental (selective processes) and spatial (neutral processes) factors seemed to govern the assembly and biogeography of abundant and rare bacterial subcommunities, although both factors explained only a small fraction of variation within the rare subcommunity. More importantly, variation partitioning (based on adjusted R-2 in redundancy analysis) showed that spatial factors exhibited a slightly greater influence on both abundant and rare subcommunities compared to environmental selection; however, the abundant subcommunity had a much stronger response to spatial factors (17.3% of pure variance was explained) than that shown by the rare bacteria (3.5%). These results demonstrate that environmental selection and neutral processes explained the similar biogeographic patterns of abundant and rare subcommunities, but a large proportion of unexplained variation in the rare taxa (91.1%) implies that more complex assembly mechanisms may exist to shape the rare bacterial assemblages in the three subtropical bays.",2018,12,10.1038/s41396-018-0153-6
"Zhang, HJ; Huang, XL; Huang, L; Bao, FJ; Xiong, SL; Wang, K; Zhang, DM",Microeukaryotic biogeography in the typical subtropical coastal waters with multiple environmental gradients,SCIENCE OF THE TOTAL ENVIRONMENT,"The determinants of microeukaryotic biogeography in coastal waters at a regional scale remain largely unclear. The coastal northern Zhejiang (in the East China Sea) is a typical subtropical marine ecosystemwithmultiple environmental gradients that has been extensively perturbed by anthropogenic activities. Thus, it is a valuable region to investigate the key drivers that shape microbial biogeography. We investigated microeukaryotic communities in surface waters from115 stations in this region using 18S ribosomal RNA gene amplicon sequencing. The microeukaryotic communities were mainly comprised of Dinoflagellata, Ciliophora, Protalveolata, Rhizaria, Stramenopiles and Cryptophyceae. The top abundant operational taxonomic units (OTUs) were highly specific for distinct habitat types, exhibiting significant environment-conditioned features; however, the cosmopolitan OTUs were not strongly correlated with the measured environmental variables. Total phosphorus and suspended particles were major environmental determinants of microeukaryotic alpha-diversity. Environmental variables, particularly temperature, salinity, pH and silicate concentration, were strongly associated with the microeukaryotic community composition. Overall, environmental and spatial factors explained 55.92% of community variation in total with 34.03% of the variation shared, suggesting that spatially structured environmental variations mainly conditioned the microeukaryotic biogeography in this region. Additionally, dispersal limitation, as indicated by the great pure spatial effect and distance-decay pattern, was another important factor. In summary, our results reveal that spatially structured environmental variation and dispersal limitation mainly conditioned the microeukaryotic biogeography. The results may provide useful distribution patterns of microeukaryotes to determine sources of microbes from marine ecosystems that may facilitate the utilization of coastal resources. (C) 2018 Elsevier B.V. All rights reserved.",2018,635,10.1016/j.scitotenv.2018.04.142
"Liu, LM; Su, JQ; Guo, YY; Wilkinson, DM; Liu, ZW; Zhu, YG; Yang, J",Large-scale biogeographical patterns of bacterial antibiotic resistome in the waterbodies of China,ENVIRONMENT INTERNATIONAL,"Antibiotic resistance genes (ARGs) are widespread in aquatic environments, but we know little about their biogeographical distribution and occurrence at national scales. Here we analyzed the patterns of ARGs from 42 natural waterbodies (natural lakes and reservoirs) across China using high-throughput approaches. The major ARGs were multidrug genes and the main resistance mechanism was the efflux pump. Although the absolute abundance of ARGs (gene copies/L) in the south/central waterbodies was similar to the northern waterbodies, the normalized abundance of ARGs (ARGs/16S rRNA gene copy number) was higher in the south/central waterbodies than in the north (mainly because of the aminoglycoside and multidrug resistance genes). Human activities strongly correlated with the normalized abundance of ARGs. The composition of ARGs in the waterbodies of south/central China was different from that in the north, and ARGs showed a distance-decay relationship. Anthropogenic factors had the most significant effects on this spatial distribution of ARG composition, followed by the spatial, bacterial and physicochemical factors. These indicate that the ARGs exhibited biogeographical patterns and that multiple ecological mechanisms - such as environmental selection (human activities and local physicochemical parameters) and dispersal limitation - influence distribution of ARGs in these waters. In general, our results provide a valuable ecological insight to explain the large-scale dispersal patterns in ARGs, thereby having potential applications for both public health and environmental management.",2018,117,10.1016/j.envint.2018.05.023
"Tian, J; He, NP; Kong, WD; Deng, Y; Feng, K; Green, SM; Wang, XB; Zhou, JZ; Kuzyakov, Y; Ye, GR",Deforestation decreases spatial turnover and alters the network interactions in soil bacterial communities,SOIL BIOLOGY & BIOCHEMISTRY,"Despite important progress in understanding the influence of deforestation on the bacterial a diversity and community structure at local scales, little is known about deforestation impacts in terms of spatial turnover and soil bacterial community network interactions, especially at regional or global scales. To address this research gap, we examined the bacterial spatial turnover rate and the species networks in paired primary and secondary forest soils along a 3700-km north-south transect in eastern China using high-throughput 16S rRNA gene sequencing. The spatial turnover rate of bacterial communities was higher in primary forests than in secondary, suggesting deforestation increased biotic homogenization at a large geographic scale. Multiple regression on matrices analysis revealed that both geographic distance and soil properties (especially soil pH and organic matter availability) strongly affected bacterial spatial turnover. Through the phylogenetic molecular ecological network approach, we demonstrate that the bacterial network of primary forests was more intricate than in secondary forests. This suggests that microbial species have greater niche-sharing and more interactions in primary forests as compared to secondary forests. On the other hand, the bacterial network in secondary forests was more modular, and the taxa tended to co-occur, with positive correlations accounting for 82% of all potential interactions. In conclusion, our findings demonstrate that anthropogenic deforestation has clear effects on bacterial spatial turnover and network interactions, with potential for serious consequences such as microbial diversity loss in primary forests.",2018,123,10.1016/j.soilbio.2018.05.007
"Zhang, M; Chen, FZ; Shi, XL; Yang, Z; Kong, FX",Association between temporal and spatial beta diversity in phytoplankton,ECOGRAPHY,"The rates of temporal and spatial species turnover have been compared in different organisms and scales, revealing that both are not independent but, rather, associated. However, the knowledge is limited for the association between spatial turnover and temporal turnover. Here, we performed two investigations of the phytoplankton composition in the lakes of the Yangtze River catchment in China in the spring and summer of 2012, which covered regional spatial scale and two-season temporal scale. We analysed the association between temporal and spatial species turnover in phytoplankton. The results showed that 1) the two-season temporal turnover of phytoplankton varied based on the mean values and the coefficient of variance of environmental variables, and pH was the most important variable negatively affecting the temporal turnover; 2) the spatial beta diversity of phytoplankton in summer was higher than that in spring, and the distance decay pattern was significant in summer, but not in spring; 3) the variation in spatial turnover in spring and summer was attributed to the primary environmental variables (nitrogen, phosphorus and underwater available light) and broader-scale spatial variables; 4) the proportion of jointly explained variation of spatial Bray-Curtis dissimilarity by the environment and space increased from similar to 38% (spring) to similar to 55% (summer), which was mainly due to the variation in spatially structured environmental variables during the two-season temporal turnover, such as pH and ion concentrations; 5) the community compositions in summer were more similar between the lakes with similar two-season temporal turnover. These results indicate that the spatial turnover of phytoplankton composition in summer was partially predetermined by the variation in environmental variables and phytoplankton composition during the process of two-season temporal turnover, and highlight the understanding of temporal variations in spatial beta diversity as well as the underlying assembly mechanisms in phytoplankton.",2018,41,10.1111/ecog.03340
"Potgieter, S; Pinto, A; Sigudu, M; du Preez, H; Ncube, E; Venter, S",Long-term spatial and temporal microbial community dynamics in a large-scale drinking water distribution system with multiple disinfectant regimes,WATER RESEARCH,"Long-term spatial-temporal investigations of microbial dynamics in full-scale drinking water distribution systems are scarce. These investigations can reveal the process, infrastructure, and environmental factors that influence the microbial community, offering opportunities to re-think microbial management in drinking water systems. Often, these insights are missed or are unreliable in short-term studies, which are impacted by stochastic variabilities inherent to large full-scale systems. In this two-year study, we investigated the spatial and temporal dynamics of the microbial community in a large, full scale South African drinking water distribution system that uses three successive disinfection strategies (i.e. chlorination, chloramination and hypochlorination). Monthly bulk water samples were collected from the outlet of the treatment plant and from 17 points in the distribution system spanning nearly 150 km and the bacterial community composition was characterised by Illumina MiSeq sequencing of the V4 hypervariable region of the 16S rRNA gene. Like previous studies, Alpha- and Betaproteobacteria dominated the drinking water bacterial communities, with an increase in Betaproteobacteria post-chloramination. In contrast with previous reports, the observed richness, diversity, and evenness of the bacterial communities were higher in the winter months as opposed to the summer months in this study. In addition to temperature effects, the seasonal variations were also likely to be influenced by changes in average water age in the distribution system and corresponding changes in disinfectant residual concentrations. Spatial dynamics of the bacterial communities indicated distance decay, with bacterial communities becoming increasingly dissimilar with increasing distance between sampling locations. These spatial effects dampened the temporal changes in the bulk water community and were the dominant factor when considering the entire distribution system. However, temporal variations were consistently stronger as compared to spatial changes at individual sampling locations and demonstrated seasonality. This study emphasises the need for long-term studies to comprehensively understand the temporal patterns that would otherwise be missed in short-term investigations. Furthermore, systematic long-term investigations are particularly critical towards determining the impact of changes in source water quality, environmental conditions, and process operations on the changes in microbial community composition in the drinking water distribution system. (C) 2018 Elsevier Ltd. All rights reserved.",2018,139,10.1016/j.watres.2018.03.077
