AU,TI,SO,AB,PY,VL,DI
"Soininen, J; Heino, J; Wang, JJ",A meta-analysis of nestedness and turnover components of beta diversity across organisms and ecosystems,GLOBAL ECOLOGY AND BIOGEOGRAPHY,"Aim: The number of studies investigating the nestedness and turnover components of beta diversity has increased substantially, but our general understanding of the drivers of turnover and nestedness remains elusive. Here, we examined the effects of species traits, spatial extent, latitude and ecosystem type on the nestedness and turnover components of beta diversity. Location: Global. Time period: 1968-2017. Major taxa studied: From bacteria to mammals. Methods: From the 99 studies that partition total beta diversity into its turnover and nestedness components, we assembled 269 and 259 data points for the pairwise and multiple site beta-diversity metrics, respectively. Our data covered a broad variation in species dispersal type, body size and trophic position. The data were from freshwater, marine and terrestrial realms, and encompassed geographical areas from the tropics to near polar regions. We used linear modelling as a meta-regression tool to analyse the data. Results: Pairwise turnover, multiple site turnover and total beta diversity all decreased significantly with latitude. In contrast, multiple site nestedness showed a positive relationship with latitude. Beta-diversity components did not generally differ among the realms. The turnover component and total beta diversity increased with spatial extent, whereas nestedness was scale invariant for pairwise metrics. Multiple site beta-diversity components did not vary with spatial extent. Surprisingly, passively dispersed organisms had lower turnover and total beta diversity than flying organisms. Body size showed a relatively weak relationship with beta diversity but had important interactions with trophic position, thus also affecting beta diversity via interactive effects. Producers had significantly higher average pairwise turnover and total beta diversity than carnivores. Main conclusions: The present results provide evidence that species turnover, being consistently the larger component of total beta diversity, and nestedness are related to the latitude of the study area and intrinsic organismal features. We showed that two beta-diversity components had generally opposing patterns with regard to latitude. We highlight that beta-diversity partition may give additional insights into the underlying causes of spatial variability in biotic communities compared with total beta diversity alone.",2018,27,10.1111/geb.12660
"Anslan, S; Bahram, M; Tedersoo, L",Seasonal and annual variation in fungal communities associated with epigeic springtails (Collembola spp.) in boreal forests,SOIL BIOLOGY & BIOCHEMISTRY,"Soil fauna mediate nutrient cycling through engineering physical properties and altering microbial commtmities in soil. Collembola is one of the most abundant groups of soil fauna, which regulates microbial communities by consumption and dispersal. The spatial structure of associations between Collembola and soil microbes have been described in several studies, but temporal variation of these associations remains unclear. Using high throughput sequencing, we studied the fungal communities on Collembola (Entomobiya nivalis, Orchesella flavescens, Pogonognathellus longicornis) body surface, gut and their immediate habitat (topsoil samples) in four seasons across three years. The soil samples were characterized by fairly uniform relative abundance of saprotrophic and mycorrhizal fungi, whereas collembolans were associated mostly with saprotrophs. The structure of fungal communities from all substrate types exhibited comparable patterns of temporal distance decay of shnilarity. Unlike in soil, fungal richness and composition in Collembola body and gut samples exhibited seasonal and annual variation, with a significant interaction term, indicating low predictability. These results reflect spatial and temporal plasticity of the fungal communities associated with epigeic Collembola, indicating the high adaptability of collembolans to available conditions. We found that the Collembola associations with fungi (including diet) did not vary among the studied epigeic Collembola species. The detected high diversity of fungi associated with Collembola suggests that dispersal by arthropod vectors may represent a powerful alternative to aerial dispersal of fungal propagules.",2018,116,10.1016/j.soilbio.2017.10.021
"Marcelino, VR; van Oppen, MJH; Verbruggen, H",Highly structured prokaryote communities exist within the skeleton of coral colonies,ISME JOURNAL,"Physiological performance, disease and bleaching prevalence are often patchy within individual coral colonies. These responses are largely influenced by coral-associated microbes, but how the coral microbiome changes over small spatial scales has never been quantified before. We performed a high-resolution quantification of the spatial scale of microbial species turnover (ss-diversity) within skeletons of boulder-forming Porites corals. We found very strong prokaryotic species turnover across spatial scales ranging from 4 mm to 2 m within individual colonies, possibly resulting from dispersal limitation and microbial interactions. The microalgal community was more homogeneously distributed, which is likely due to these photosymbionts actively boring through limestone. Our findings highlight unprecedented levels of intra-colony heterogeneity in the skeletal microbiome, which has implications for the experimental design of coral microbiome studies and for our understanding of coral resilience.",2018,12,10.1038/ismej.2017.164
"Zhao, F; Filker, S; Xu, KD; Huang, PP; Zheng, S",Patterns and Drivers of Vertical Distribution of the Ciliate Community from the Surface to the Abyssopelagic Zone in the Western Pacific Ocean,FRONTIERS IN MICROBIOLOGY,"The deep sea is one of the largest but least understood ecosystems on earth. Knowledge about the diversity and distribution patterns as well as drivers of microbial eukaryote (including ciliates) along the water column, particularly below the photic zone, is scarce. In this study, we investigated the diversity of pelagic ciliates, the main group of marine microeukaryotes, their vertical distribution from the surface to the abyssopelagic zone, as well as their horizontal distribution over a distance of 1,300 km in the Western Pacific Ocean, using high-throughput DNA and cDNA (complementary DNA) sequencing. No distance-decay relationship could be detected along the horizontal scale; instead, a distinct vertical distribution within the ciliate communities was revealed. The alpha diversity of the ciliate communities in the deep chlorophyll maximum (DCM) and the 200 m layer turned out to be significantly higher compared with the other water layers. The ciliate communities in the 200 m water layer appeared to be more similar to those in deeper layers from 1,000 m to about 5,000 m than to the surface and DCM ciliate communities. Dominant species in the bathypelagic and abyssopelagic zone, particularly some parasites, were also detected in the 200 m layer, but were almost absent in the surface layer. The 200 m layer, therefore, seems to be an important species bank for deep ocean layers. Statistical analyses further revealed significant effects of temperature and chlorophyll a on the partitioning of ciliate diversity, indicating that environmental factors are a stronger force in shaping marine pelagic ciliate communities than the geographic distance.",2017,8,10.3389/fmicb.2017.02559
"Kohout, P; Bahram, M; Polme, S; Tedersoo, L","Elevation, space and host plant species structure Ericaceae root-associated fungal communities in Papua New Guinea",FUNGAL ECOLOGY,"Our study aimed to identify significant predictors (spatial distance, elevation, host plant taxonomy) which shape the structure of endophytic fungal (ENDF) and putative ericoid mycorrhizal (ErMF) communities associated with roots of Ericaceae in Papua New Guinea. Roots of five Ericaceae together with one non-Ericaceae species were sampled at an experimental site and one common Ericaceae species was chosen for sampling along an elevation gradient. ENDF and putative ErMF communities were determined using the 454-sequencing approach. ENDF as well as putative ErMF communities were affected by interacting host plant. While the putative ErMF community was structured by host plants at the genus level, the ENDF community was affected by host plant subfamily level. Composition of ENDF as well as putative ErMF communities were affected by elevation. Non-Ericaceae plant species (Hypericum sp.) harbored similar communities of ENDF as well as putative ErMF as Ericaceae plants. Our study provides a first insight into ErMF and ENDF community ecology of Ericaceae in Papua New Guinea. (C) 2017 Elsevier Ltd and British Mycological Society. All rights reserved.",2017,30,10.1016/j.funeco.2017.09.004
"Yang, T; Adams, JM; Shi, Y; Sun, HB; Cheng, L; Zhang, YJ; Chu, HY",Fungal community assemblages in a high elevation desert environment: Absence of dispersal limitation and edaphic effects in surface soil,SOIL BIOLOGY & BIOCHEMISTRY,"Recent studies have shown the significant effects of environmental selection and possible dispersal limitation on soil fungal communities. However, less is known about the role of soil depth in fungal community assemblages, especially under soil environments that are intensely cold, infertile and water deficient In Ngari drylands of the Asiatic Plateau, we studied fungal assemblages at two soil depths, using Illumina sequencing of the ITS2 region for fungal identification (0-15 cm as the surface soil and 15 -30 cm as the subsurface soil). Fungal diversity in the surface soil was much higher than that in the subsurface soil (P < 0.001), and communities differed significantly between the two layers (P = 0.001). Neither soil properties nor dispersal limitation could explain variation in the surface-soil fungal community. For the subsurface, by contrast, soil, climate and space explained 27% of variation in fungal community. Collectively, these results point to high dispersal rates and absence of edaphic effects in the surface-soil fungal community assemblage in Ngari drylands. It also suggests that for soil fungi with highly effective dispersal, regional distributions may fit with Bass-Beckings paradigm that Everything is everywhere. (C) 2017 Elsevier Ltd. All rights reserved.",2017,115,10.1016/j.soilbio.2017.09.013
"Tian, JQ; Wu, B; Chen, H; Jiang, N; Kang, XM; Liu, XZ","Patterns and drivers of fungal diversity along an altitudinal gradient on Mount Gongga, China",JOURNAL OF SOILS AND SEDIMENTS,"Fungi are essential components of soil microbial communities and have a crucial role in biogeochemical processes. Alpine regions are sensitive to climate change, and the importance of changes in fungal community composition along altitudinal gradients in alpine regions is hotly debated. We used 454 pyrosequencing approaches to investigate the fungal communities at 1600, 2300, 2800, 3000, and 3900 m above sea level along an altitudinal gradient on Mount Gongga. The results showed that Agaricomycetes, Sordariomycetes, and Tremellomycetes are the dominant classes at all sampling sites. Operational taxonomic unit richness decreased with increasing altitude, and the fungal communities were clustered into three groups that corresponded to altitudes of, i.e., 1600, 2300, and above 2800 m. The evenness of fungi was not significantly correlated with altitude, whereas beta diversities were significantly correlated with altitude. The distance-based redundancy analysis and Mantel test indicated that the composition of fungal assemblages was mostly driven by altitude and temperature. Our results indicated that ecological processes possibly related to altitude and temperature play an important role in structuring fungal biodiversity along the elevational gradient. Our results highlight that different microbes may respond differently to environmental gradients.",2017,17,10.1007/s11368-017-1701-9
"Kleinteich, J; Hildebrand, F; Bahram, M; Voigt, AY; Wood, SA; Jungblut, AD; Kupper, FC; Quesada, A; Camacho, A; Pearce, DA; Convey, P; Vincent, WF; Zarfl, C; Bork, P; Dietrich, DR",Pole-to-Pole Connections: Similarities between Arctic and Antarctic Microbiomes and Their Vulnerability to Environmental Change,FRONTIERS IN ECOLOGY AND EVOLUTION,"The global biogeography of microorganisms remains poorly resolved, which limits the current understanding of microbial resilience toward environmental changes. Using high-throughput 16S rRNA gene amplicon sequencing, we characterized the microbial diversity of terrestrial and lacustrine biofilms from the Arctic, Antarctic and temperate regions. Our analyses suggest that bacterial community compositions at the poles are more similar to each other than they are to geographically closer temperate habitats, with 32% of all operational taxonomic units (OTUs) co-occurring in both polar regions. While specific microbial taxa were confined to distinct regions, representing potentially endemic populations, the percentage of cosmopolitan taxa was higher in Arctic (43%) than in Antarctic samples (36%). The overlap in polar microbial OTUs may be explained by natural or anthropogenically-mediated dispersal in combination with environmental filtering. Current and future changing environmental conditions may enhance microbial invasion, establishment of cosmopolitan genotypes and loss of endemic taxa.",2017,5,10.3389/fevo.2017.00137
"Wang, JM; Zhang, TH; Li, LP; Li, JW; Feng, YM; Lu, Q",The Patterns and Drivers of Bacterial and Fungal beta-Diversity in a Typical Dryland Ecosystem of Northwest China,FRONTIERS IN MICROBIOLOGY,"Dryland ecosystems cover more than 30% of the terrestrial area of China, while processes that shape the biogeographic patterns of bacterial and fungal beta-diversity have rarely been evaluated synchronously. To compare the biogeographic patterns and its drivers of bacterial and fungal p-diversity, we collected 62 soil samples from a typical dryland region of northwest China. We assessed bacterial and fungal communities by sequencing bacterial 16S rRNA gene and fungal ITS data. Meanwhile, the beta-diversity was decomposed into two components: species replacement (species turnover) and nestedness to further explore the bacterial and fungal beta-diversity patterns and its causes. The results show that both bacterial and fungal beta-diversity were derived almost entirely from species turnover rather than from species nestedness. Distance-decay relationships confirmed that the geographic patterns of bacterial and fungal beta-diversity were significantly different. Environmental factors had the dominant influence on both the bacterial and fungal beta-diversity and species turnover, however, the role of geographic distance varied across bacterial and fungal communities. Furthermore, both bacterial and fungal nestedness did not significantly respond to the environmental and geographic distance. Our findings suggest that the different response of bacterial and fungal species turnover to dispersal limitation and other, unknown processes may result in different biogeographic patterns of bacterial and fungal beta-diversity in the drylands of northwest China. Together, we highlight that the drivers of beta-diversity patterns vary between bacterial and fungal communities, and microbial beta-diversity are driven by multiple factors in the drylands of northwest China.",2017,8,10.3389/fmicb.2017.02126
"Chen, RR; Zhong, LH; Jing, ZW; Guo, ZY; Li, ZP; Lin, XG; Feng, YZ",Fertilization decreases compositional variation of paddy bacterial community across geographical gradient,SOIL BIOLOGY & BIOCHEMISTRY,"Fertilization is one of the most common agricultural practices to meet an increasing global demand for food products. Few investigations have been reported on spatial variation of microbial community composition in response to fertilizations in agroecosystems at a large scale. To improve the related understandings, we have evaluated the taxonomic and phylogenetic diversities of bacterial taxa in response to three fertilization strategies in six paddy experiment sites spanning across subtropical China. We found the large-scale compositional variation of paddy bacterial community is shaped by both geographic location and environmental selection, and the former is the dominant factor. The slopes of distance-decay relationships (DDR) are flattened by fertilizations, NPK (mineral NPK fertilizers) and OM (mineral NPK fertilizers plus organic amendments) when compared to Control. A flattened DDR implies that bacterial community composition is greatly homogenized by fertilizations in paddies. It is also inferred that fertilization decreases sensitivity of bacterial community to geographic and environmental factors, which is speculated to be beneficial for agroecosystem stability and yield sustainability. Results from this investigation correlate microscopic agroecosystem with macroscopic agricultural practices. (C) 2017 Elsevier Ltd. All rights reserved.",2017,114,10.1016/j.soilbio.2017.07.013
"Chen, WD; Pan, YB; Yu, LY; Yang, J; Zhang, WJ","Patterns and Processes in Marine Microeukaryotic Community Biogeography from Xiamen Coastal Waters and Intertidal Sediments, Southeast China",FRONTIERS IN MICROBIOLOGY,"Microeukaryotes play key roles in the structure and functioning of marine ecosystems. Little is known about the relative importance of the processes that drive planktonic and benthic microeukaryotic biogeography in subtropical offshore areas. This study compares the microeukaryotic community compositions (MCCs) from offshore waters (n = 12) and intertidal sediments (n = 12) around Xiamen Island, southern China, using high-throughput sequencing of 18S rDNA. This work further quantifies the relative contributions of spatial and environmental variables on the distribution of marine MCCs (including total, dominant, rare and conditionally rare taxa). Our results showed that planktonic and benthic MCCs were significantly different, and the benthic richness (6627 OTUs) was much higher than that for plankton (4044 OTUs) with the same sequencing effort. Further, we found that benthic MCCs exhibited a significant distance-decay relationship, whereas the planktonic communities did not. After removing two unique sites (N2 and N3), however, 72% variation in planktonic community was explained well by stochastic processes. More importantly, both the environmental and spatial factors played significant roles in influencing the biogeography of total and dominant planktonic and benthic microeukaryotic communities, although their relative effects on these community variations were different. However, a high proportion of unexplained variation in the rare taxa (78.1-97.4%) and conditionally rare taxa (49.0-81.0%) indicated that more complex mechanisms may influence the assembly of the rare subcommunity. These results demonstrate that patterns and processes in marine microeukaryotic community assembly differ among the different habitats (coastal water vs. intertidal sediment) and different communities (total, dominant, rare and conditionally rare microeukaryotes), and provide novel insight on the microeukaryotic biogeography and ecological mechanisms in coastal waters and intertidal sediments at local scale.",2017,8,10.3389/fmicb.2017.01912
"Tong, XZ; Leung, MHY; Wilkins, D; Lee, PKH",City-scale distribution and dispersal routes of mycobiome in residences,MICROBIOME,"Background: Pathogenic and allergenic bacteria and fungi within the indoors can bring detrimental health effects on the occupants. We previously studied the bacterial communities found in households located throughout Hong Kong as well as the skin surfaces of the occupants. As a complementary study, here, we investigated the fungal communities (mycobiome) in the same residences and occupants and identified factors that are important in shaping their diversity, composition, distribution, and dispersal patterns. Results: We observed that common skin and environmental fungal taxa dominated air, surface, and skin samples. Individual and touch frequency strongly and respectively shaped the fungal community structure on occupant skin and residential surfaces. Cross-domain analysis revealed positive correlations between bacterial and fungal community diversity and composition, especially for skin samples. SourceTracker prediction suggested that some fungi can be transferred bidirectionally between surfaces and skin sites, but bacteria showed a stronger dispersal potential. In addition, we detected a modest but significant association between indoor airborne bacterial composition and geographic distance on a city-wide scale, a pattern not observed for fungi. However, the distance-decay effects were more pronounced at shorter local scale for both communities, and airflow might play a prominent role in driving the spatial variation of the indoor airborne mycobiome. Conclusions: Our study suggests that occupants exert a weaker influence on surface fungal communities compared to bacterial communities, and local environmental factors, including air currents, appear to be stronger determinants of indoor airborne mycobiome than ventilation strategy, human occupancy, and room type.",2017,5,10.1186/s40168-017-0346-7
"Jiao, S; Chen, WM; Wei, GH",Biogeography and ecological diversity patterns of rare and abundant bacteria in oil-contaminated soils,MOLECULAR ECOLOGY,"Revealing the biogeographies and ecologies of rare and abundant microorganisms is crucial to understand ecosystem diversity and function. In this study, we investigated the biogeographic assemblies and ecological diversity patterns of rare and abundant bacteria in long-term oil-contaminated soils at intervals of 46-360km by performing high-throughput sequencing of 16S rRNA genes. The results clearly revealed distinct distribution patterns for rare and abundant bacteria in soil samples. Rare taxa were unevenly distributed; however, abundant taxa were ubiquitous across all samples. Both rare and abundant subcommunities showed significant distance-decay relationships, and their assemblies were driven by different factors. The rare subcommunity primarily exhibited a spatially structured distribution (i.e., stochastic processes), while edaphic factors (i.e., deterministic processes) largely contributed to the structure of the abundant subcommunity. A network analysis revealed closer relationships between abundant bacteria and their heightened influence on other co-occurrences in the community compared with rare species. In conclusion, rare microbial taxa may play potential roles in maintaining ecosystem diversity, although they do not appear to be central to microbial networks. Abundant microbes are vital for microbial co-occurrences in oil-contaminated soils, and high relative abundance and ubiquitous distribution suggest potential roles in the degradation of organic pollutants.",2017,26,10.1111/mec.14218
"Fan, KK; Cardona, C; Li, YT; Shi, Y; Xiang, XJ; Shen, CC; Wang, HF; Gilbert, JA; Chu, HY",Rhizosphere-associated bacterial network structure and spatial distribution differ significantly from bulk soil in wheat crop fields,SOIL BIOLOGY & BIOCHEMISTRY,"The spatial distribution of bacteria in bulk soil has been well studied, but little is known about the bacterial biogeography in the rhizosphere of crops. Here, we investigated bacterial distribution in bulk soil, loosely- and tightly-bound soils, from wheat fields distributed across 800,000 km(2) of the North China Plain. Bacterial community composition differed dramatically among bulk and rhizospheric soils, and bacterial diversity decreased with the root proximity. Soil pH correlated with bacterial community composition and diversity in three compartments. Bacterial community in tightly bound soil formed a hub-based network topology with higher transitivity and greater number of central nodes compared with loosely bound and bulk soils, potentially as a result of more direct ecological interactions between the members of the tightly bound soil compartment. Bulk and rhizospheric soils maintained similar compositional distance decay patterns (with equal decay rates), but distinct phylogenetic distance decay patterns (with steeper slope of tightly bound soil). Geographical distance described a relatively greater proportion of bacterial spatial distribution in tightly bound soil, compared with loosely bound soil and bulk soil. Deterministic processes dominated the assemblage of bacterial communities in all soil compartments, while phylogenetic clustering was weaker in tightly bound soil. Taken together, our results suggest distinct bacterial network structure and distribution patterns among bulk soil, loosely bound soil and tightly bound rhizospheric soil, which could possibly result in potential functional differentiation. (C) 2017 Elsevier Ltd. All rights reserved.",2017,113,10.1016/j.soilbio.2017.06.020
